{
  "pieces": {
    "black_bishop_c": {
      "metadata": {
        "color": "black",
        "kind": "bishop"
      },
      "status": "board",
      "x": 2,
      "y": 7
    },
    "black_bishop_f": {
      "metadata": {
        "color": "black",
        "kind": "bishop"
      },
      "status": "board",
      "x": 5,
      "y": 7
    },
    "black_king_e": {
      "metadata": {
        "color": "black",
        "kind": "king"
      },
      "status": "board",
      "x": 4,
      "y": 7
    },
    "black_knight_b": {
      "metadata": {
        "color": "black",
        "kind": "knight"
      },
      "status": "board",
      "x": 1,
      "y": 7
    },
    "black_knight_g": {
      "metadata": {
        "color": "black",
        "kind": "knight"
      },
      "status": "board",
      "x": 6,
      "y": 7
    },
    "black_pawn_a": {
      "metadata": {
        "color": "black",
        "kind": "pawn"
      },
      "status": "board",
      "x": 0,
      "y": 6
    },
    "black_pawn_b": {
      "metadata": {
        "color": "black",
        "kind": "pawn"
      },
      "status": "board",
      "x": 1,
      "y": 6
    },
    "black_pawn_c": {
      "metadata": {
        "color": "black",
        "kind": "pawn"
      },
      "status": "board",
      "x": 2,
      "y": 6
    },
    "black_pawn_d": {
      "metadata": {
        "color": "black",
        "kind": "pawn"
      },
      "status": "board",
      "x": 3,
      "y": 6
    },
    "black_pawn_e": {
      "metadata": {
        "color": "black",
        "kind": "pawn"
      },
      "status": "board",
      "x": 4,
      "y": 6
    },
    "black_pawn_f": {
      "metadata": {
        "color": "black",
        "kind": "pawn"
      },
      "status": "board",
      "x": 5,
      "y": 6
    },
    "black_pawn_g": {
      "metadata": {
        "color": "black",
        "kind": "pawn"
      },
      "status": "board",
      "x": 6,
      "y": 6
    },
    "black_pawn_h": {
      "metadata": {
        "color": "black",
        "kind": "pawn"
      },
      "status": "board",
      "x": 7,
      "y": 6
    },
    "black_queen_d": {
      "metadata": {
        "color": "black",
        "kind": "queen"
      },
      "status": "board",
      "x": 3,
      "y": 7
    },
    "black_rook_a": {
      "metadata": {
        "color": "black",
        "kind": "rook"
      },
      "status": "board",
      "x": 0,
      "y": 7
    },
    "black_rook_h": {
      "metadata": {
        "color": "black",
        "kind": "rook"
      },
      "status": "board",
      "x": 7,
      "y": 7
    },
    "white_bishop_c": {
      "metadata": {
        "color": "white",
        "kind": "bishop"
      },
      "status": "board",
      "x": 2,
      "y": 0
    },
    "white_bishop_f": {
      "metadata": {
        "color": "white",
        "kind": "bishop"
      },
      "status": "board",
      "x": 5,
      "y": 0
    },
    "white_king_e": {
      "metadata": {
        "color": "white",
        "kind": "king"
      },
      "status": "board",
      "x": 4,
      "y": 0
    },
    "white_knight_b": {
      "metadata": {
        "color": "white",
        "kind": "knight"
      },
      "status": "board",
      "x": 1,
      "y": 0
    },
    "white_knight_g": {
      "metadata": {
        "color": "white",
        "kind": "knight"
      },
      "status": "board",
      "x": 6,
      "y": 0
    },
    "white_pawn_a": {
      "metadata": {
        "color": "white",
        "kind": "pawn"
      },
      "status": "board",
      "x": 0,
      "y": 1
    },
    "white_pawn_b": {
      "metadata": {
        "color": "white",
        "kind": "pawn"
      },
      "status": "board",
      "x": 1,
      "y": 1
    },
    "white_pawn_c": {
      "metadata": {
        "color": "white",
        "kind": "pawn"
      },
      "status": "board",
      "x": 2,
      "y": 1
    },
    "white_pawn_d": {
      "metadata": {
        "color": "white",
        "kind": "pawn"
      },
      "status": "board",
      "x": 3,
      "y": 1
    },
    "white_pawn_e": {
      "metadata": {
        "color": "white",
        "kind": "pawn"
      },
      "status": "board",
      "x": 4,
      "y": 1
    },
    "white_pawn_f": {
      "metadata": {
        "color": "white",
        "kind": "pawn"
      },
      "status": "board",
      "x": 5,
      "y": 1
    },
    "white_pawn_g": {
      "metadata": {
        "color": "white",
        "kind": "pawn"
      },
      "status": "board",
      "x": 6,
      "y": 1
    },
    "white_pawn_h": {
      "metadata": {
        "color": "white",
        "kind": "pawn"
      },
      "status": "board",
      "x": 7,
      "y": 1
    },
    "white_queen_d": {
      "metadata": {
        "color": "white",
        "kind": "queen"
      },
      "status": "board",
      "x": 3,
      "y": 0
    },
    "white_rook_a": {
      "metadata": {
        "color": "white",
        "kind": "rook"
      },
      "status": "board",
      "x": 0,
      "y": 0
    },
    "white_rook_h": {
      "metadata": {
        "color": "white",
        "kind": "rook"
      },
      "status": "board",
      "x": 7,
      "y": 0
    }
  },
  "processed_events": [],
  "revision": 0,
  "schema_version": 1
}
